{
  "vendors": ["aws", "gcp", "azure"],
  "categories": [
    "compute",
    "storage",
    "database",
    "networking",
    "security",
    "management",
    "integration",
    "containers"
  ],
  "tags": [
    "api",
    "blob",
    "cdn",
    "containers",
    "dns",
    "functions",
    "gateway",
    "iac",
    "iam",
    "kubernetes",
    "load-balancer",
    "monitoring",
    "notifications",
    "nosql",
    "object-storage",
    "queue",
    "registry",
    "relational",
    "serverless",
    "vpc"
  ],
  "variants": ["default"],
  "idPattern": "^[a-z0-9]+(\\.[a-z0-9-]+)+$",
  "variantPattern": "^[a-z0-9-]+$"
}
